{
  "name": "fragile-inputs",
  "version": "1.0.1",
  "description": "A QA/SDET field guide of edge-case inputs that break forms, search, databases, exports and assistive tech — annotated with what each one tests, what it breaks, and the correct behavior.",
  "homepage": "https://github.com/gencdeveloper/fragile-inputs",
  "license": "MIT",
  "funding": "https://buymeacoffee.com/yunusemreozudogru",
  "updated": "2026-10-06",
  "counts": {
    "inputs": 486,
    "categories": 42,
    "groups": 3
  },
  "groups": [
    {
      "id": "gen",
      "name": "General inputs",
      "description": "Edge cases every text field, form and API should survive."
    },
    {
      "id": "ind",
      "name": "Industry inputs",
      "description": "Inputs specific to regulated and transactional products. Rules and thresholds vary by jurisdiction; confirm them against your own requirements."
    },
    {
      "id": "a11y",
      "name": "Accessibility checks",
      "description": "Text, settings and console snippets for testing with assistive technology and user preferences. Each card names the WCAG 2.2 success criterion it relates to. Automated scanners catch only part of these; most need a person, a keyboard and a screen reader."
    }
  ],
  "categories": [
    {
      "id": "len",
      "group": "gen",
      "name": "Length & whitespace",
      "description": "Empty values, trimming, line breaks and length limits. Use the generator for exact boundary lengths."
    },
    {
      "id": "name",
      "group": "gen",
      "name": "Names",
      "description": "Real people have names your form did not expect. Each of these belongs to someone."
    },
    {
      "id": "addr",
      "group": "gen",
      "name": "Addresses & phone",
      "description": "US postal and phone formats that strict validation rejects or quietly corrupts."
    },
    {
      "id": "email",
      "group": "gen",
      "name": "Email",
      "description": "Valid addresses that naive regexes reject, and invalid ones they accept."
    },
    {
      "id": "num",
      "group": "gen",
      "name": "Numbers & currency",
      "description": "Parsing, precision, overflow and formats copied from spreadsheets or other locales."
    },
    {
      "id": "date",
      "group": "gen",
      "name": "Dates & time",
      "description": "Impossible dates, daylight saving gaps, time zones and ambiguous formats."
    },
    {
      "id": "case",
      "group": "gen",
      "name": "Case & locale",
      "description": "Uppercasing and lowercasing are not reversible and depend on the user's language."
    },
    {
      "id": "inv",
      "group": "gen",
      "name": "Invisible characters",
      "description": "Characters that take no visible space but change the data. They arrive through copy and paste."
    },
    {
      "id": "norm",
      "group": "gen",
      "name": "Lookalikes & normalization",
      "description": "Different code points that render the same. They defeat equality checks, search and uniqueness rules."
    },
    {
      "id": "emo",
      "group": "gen",
      "name": "Emoji & graphemes",
      "description": "One visible character made of several code points. Breaks length limits and truncation."
    },
    {
      "id": "bidi",
      "group": "gen",
      "name": "Scripts & direction",
      "description": "Right-to-left languages, mixed direction and non-Latin writing systems."
    },
    {
      "id": "magic",
      "group": "gen",
      "name": "Reserved words",
      "description": "Ordinary text that a system mistakes for a value, a keyword or a property."
    },
    {
      "id": "file",
      "group": "gen",
      "name": "File names",
      "description": "Upload and download names that confuse operating systems, servers and users."
    },
    {
      "id": "pass",
      "group": "gen",
      "name": "Passwords",
      "description": "Inputs that expose hashing limits, trimming and normalization in authentication."
    },
    {
      "id": "sec",
      "group": "gen",
      "name": "Security",
      "description": "Basic probes that show whether input is ever interpreted as code.",
      "warning": "Use these only on systems you are authorized to test."
    },
    {
      "id": "fin",
      "group": "ind",
      "name": "Fintech & payments",
      "description": "Money movement: rounding, currencies, bank and card numbers, limits and cutoffs."
    },
    {
      "id": "aml",
      "group": "ind",
      "name": "AML & sanctions screening",
      "description": "Name-matching and threshold inputs for KYC, sanctions and transaction monitoring.",
      "warning": "Names here are fictional. Pair each variant with a matching entry in your own test watchlist, or swap in a real list entry from your test data."
    },
    {
      "id": "gamb",
      "group": "ind",
      "name": "Gambling & lottery",
      "description": "Age gates, stakes, odds, ticket numbers, geofencing and responsible gambling limits."
    },
    {
      "id": "health",
      "group": "ind",
      "name": "Healthcare",
      "description": "Doses, units, patient identity and clinical codes. Small input mistakes here become safety incidents."
    },
    {
      "id": "shop",
      "group": "ind",
      "name": "E-commerce",
      "description": "Quantities, coupons, totals, tax and shipping rules at checkout."
    },
    {
      "id": "travel",
      "group": "ind",
      "name": "Travel & aviation",
      "description": "Bookings, passenger names, airport and flight codes, time zones and travel documents."
    },
    {
      "id": "hr",
      "group": "ind",
      "name": "HR & payroll",
      "description": "Tax IDs, timesheets around daylight saving, overtime and pay dates."
    },
    {
      "id": "auto",
      "group": "ind",
      "name": "Automotive & mobility",
      "description": "VINs, plates, odometers, EV data and trip records."
    },
    {
      "id": "tel",
      "group": "ind",
      "name": "Telecom",
      "description": "Phone numbers, SIM and device identifiers, SMS encoding and dialing rules."
    },
    {
      "id": "log",
      "group": "ind",
      "name": "Logistics & shipping",
      "description": "Tracking numbers, containers, air waybills, customs codes and delivery windows."
    },
    {
      "id": "ins",
      "group": "ind",
      "name": "Insurance",
      "description": "Policies, claims, coverage limits, beneficiaries and age rating."
    },
    {
      "id": "gov",
      "group": "ind",
      "name": "Government & public services",
      "description": "Identity documents, national IDs, placeholder data and addresses for people without one."
    },
    {
      "id": "util",
      "group": "ind",
      "name": "Energy & utilities",
      "description": "Meter reads, rollovers, net metering, tariffs and billing periods."
    },
    {
      "id": "re",
      "group": "ind",
      "name": "Real estate & property",
      "description": "Parcel numbers, legal descriptions, units, areas and listing data."
    },
    {
      "id": "legal",
      "group": "ind",
      "name": "Legal & compliance",
      "description": "Citations, docket numbers, deadlines, signatures and redaction."
    },
    {
      "id": "edu",
      "group": "ind",
      "name": "Education",
      "description": "Student records, course codes, grades and GPA math."
    },
    {
      "id": "pharma",
      "group": "ind",
      "name": "Pharma & life sciences",
      "description": "Drug codes, lot numbers, units, scientific notation and chemistry strings."
    },
    {
      "id": "mfg",
      "group": "ind",
      "name": "Manufacturing",
      "description": "Part and serial numbers, barcodes, tolerances, date codes and units of measure."
    },
    {
      "id": "cons",
      "group": "ind",
      "name": "Construction & engineering",
      "description": "Dimensions, symbols, fractions, survey notation and drawing numbers."
    },
    {
      "id": "media",
      "group": "ind",
      "name": "Media & content",
      "description": "Titles, artist names, timecodes, subtitles and catalog codes."
    },
    {
      "id": "cyber",
      "group": "ind",
      "name": "Cybersecurity & networking",
      "description": "IP addresses, domains, hashes and identifiers that parse in surprising ways."
    },
    {
      "id": "sr",
      "group": "a11y",
      "name": "Screen reader content",
      "description": "Text that sounds wrong when read aloud. Test with VoiceOver (Cmd+F5 on macOS), NVDA (free, Windows) or TalkBack (Android)."
    },
    {
      "id": "zoom",
      "group": "a11y",
      "name": "Zoom, reflow & spacing",
      "description": "Browser zoom, narrow viewports and user text settings. Values here are settings or snippets to apply."
    },
    {
      "id": "kbd",
      "group": "a11y",
      "name": "Keyboard & focus",
      "description": "Complete the task without a mouse. Snippets run in the browser console."
    },
    {
      "id": "form",
      "group": "a11y",
      "name": "Forms & errors",
      "description": "Labels, error messages, time limits and announcements."
    },
    {
      "id": "vis",
      "group": "a11y",
      "name": "Color, motion & display",
      "description": "Contrast boundaries and system preferences. Ratios are computed with the WCAG relative luminance formula."
    },
    {
      "id": "img",
      "group": "a11y",
      "name": "Images & language",
      "description": "Text alternatives, images of text and language attributes."
    }
  ],
  "inputs": [
    {
      "id": "fi-001",
      "group": "gen",
      "category": "len",
      "title": "Empty value",
      "value": "",
      "tests": "Required field validation.",
      "breaks": "Empty string and null are handled differently; empty records show up as blank rows.",
      "expected": "A clear validation message on required fields."
    },
    {
      "id": "fi-002",
      "group": "gen",
      "category": "len",
      "title": "Spaces only",